{
  "$schema": "./capabilities.schema.json",
  "project": "ATE — Autonomous Trading Engine",
  "manifest_version": 1,
  "updated_at": "2026-10-09",
  "development_phase": "Phase III — Universal Data Platform",
  "completed_prompt": 20,
  "pre_production_version": "0.20.0-instrument-registry.1",
  "capabilities": {
    "repository_foundation": true,
    "engineering_constitution": true,
    "architecture_decision_records": true,
    "documentation_standards": true,
    "help_usability_standard": true,
    "configuration_principles": true,
    "security_baseline": true,
    "quality_tooling": true,
    "foundation_tests": true,
    "core_domain_contracts": true,
    "domain_primitives": true,
    "contract_validation": true,
    "contract_serialization": true,
    "universal_market_data_contracts": true,
    "canonical_market_observation_model": true,
    "canonical_quote_model": true,
    "canonical_tick_model": true,
    "canonical_trade_observation_model": true,
    "canonical_ohlcv_bar_model": true,
    "explicit_volume_semantics": true,
    "explicit_market_data_timestamp_semantics": true,
    "provider_neutral_market_data_provenance": true,
    "market_data_structural_validation": true,
    "market_data_correction_revision_foundation": true,
    "market_data_deterministic_serialization": true,
    "market_data_schema_identity": true,
    "market_data_contract_authority": true,
    "historical_data_laboratory": true,
    "historical_artifact_intake": true,
    "historical_artifact_checksum": true,
    "historical_format_detection": true,
    "historical_csv_import": true,
    "historical_json_import": true,
    "historical_ndjson_import": true,
    "historical_parquet_import": true,
    "historical_schema_inspection": true,
    "historical_declarative_mapping": true,
    "historical_canonical_normalization": true,
    "historical_rejection_quarantine": true,
    "historical_dataset_manifest": true,
    "historical_dataset_publication": true,
    "historical_bounded_query": true,
    "historical_runtime_service": true,
    "data_quality_engine": true,
    "data_quality_profiles": true,
    "data_quality_rule_registry": true,
    "data_quality_rule_statuses": true,
    "data_quality_findings": true,
    "data_quality_bounded_evidence": true,
    "data_quality_suppression_counts": true,
    "data_quality_gap_detection": true,
    "data_quality_duplicate_detection": true,
    "data_quality_timestamp_sequence_detection": true,
    "data_quality_freshness_staleness": true,
    "data_quality_quote_spread_detection": true,
    "data_quality_ohlc_detection": true,
    "data_quality_outlier_detection": true,
    "data_quality_volume_detection": true,
    "data_quality_timezone_session_detection": true,
    "data_quality_provenance_detection": true,
    "data_quality_dataset_integrity": true,
    "data_quality_scoring": true,
    "data_quality_non_trading_qualification": true,
    "data_quality_report_manifest": true,
    "data_quality_report_publication": true,
    "data_quality_runtime_service": true,
    "dataset_catalogue": true,
    "dataset_family_identity": true,
    "immutable_dataset_versions": true,
    "dataset_registration": true,
    "dataset_registration_fingerprint": true,
    "dataset_provenance_registration": true,
    "dataset_transformation_metadata": true,
    "dataset_lineage_graph": true,
    "dataset_lineage_edges": true,
    "dataset_ancestry": true,
    "dataset_descendants": true,
    "dataset_root_source_resolution": true,
    "dataset_integrity_metadata": true,
    "dataset_integrity_verification": true,
    "dataset_quality_references": true,
    "dataset_lifecycle": true,
    "dataset_supersession": true,
    "dataset_eligibility": true,
    "dataset_reproducibility": true,
    "dataset_discovery": true,
    "dataset_impact_analysis": true,
    "dataset_active_version_management": true,
    "dataset_catalogue_snapshots": true,
    "dataset_catalogue_diagnostics": true,
    "canonical_event_envelope": true,
    "domain_architecture_tests": true,
    "application_runtime": true,
    "lifecycle_orchestration": true,
    "service_composition": true,
    "dependency_ordering": true,
    "runtime_mode_enforcement": true,
    "health_readiness_foundation": true,
    "graceful_degradation_foundation": true,
    "graceful_shutdown": true,
    "runtime_snapshots": true,
    "internal_event_architecture": true,
    "event_registry": true,
    "typed_event_publication": true,
    "event_routing": true,
    "correlation_propagation": true,
    "causation_propagation": true,
    "idempotency_foundation": true,
    "ordering_foundation": true,
    "bounded_retry": true,
    "dead_letter_foundation": true,
    "backpressure_foundation": true,
    "event_diagnostics": true,
    "runtime_event_service_integration": true,
    "transactional_persistence": true,
    "persistence_service": true,
    "state_authority_foundation": true,
    "repository_abstraction": true,
    "transaction_manager": true,
    "optimistic_concurrency": true,
    "immutable_state_history": true,
    "durable_audit_foundation": true,
    "transactional_outbox": true,
    "durable_inbox": true,
    "durable_idempotency": true,
    "durable_dead_letters": true,
    "migration_framework": true,
    "persistence_health_readiness": true,
    "restart_recovery_foundation": true,
    "utc_clock_authority": true,
    "monotonic_clock": true,
    "virtual_clock": true,
    "simulation_clock": true,
    "replay_clock": true,
    "iana_timezone_support": true,
    "timezone_conversion": true,
    "broker_time_abstraction": true,
    "market_time_abstraction": true,
    "freshness_calculation": true,
    "clock_quality_monitoring": true,
    "deterministic_timer": true,
    "deterministic_scheduler_foundation": true,
    "clock_runtime_service": true,
    "temporal_health_readiness": true,
    "event_time_integration": true,
    "persistence_time_integration": true,
    "deterministic_temporal_testing": true,
    "configuration_control_plane_foundation": true,
    "hierarchical_configuration": true,
    "configuration_domains": true,
    "scoped_configuration": true,
    "multi_dimensional_configuration_context": true,
    "configuration_inheritance": true,
    "explicit_configuration_precedence": true,
    "deterministic_configuration_resolution": true,
    "configuration_provenance": true,
    "configuration_explanation": true,
    "effective_configuration": true,
    "immutable_configuration_snapshots": true,
    "configuration_snapshot_fingerprint": true,
    "configuration_sources": true,
    "bootstrap_configuration_boundary": true,
    "configuration_runtime_service": true,
    "configuration_health_readiness": true,
    "configuration_environment_isolation": true,
    "safe_configuration_diagnostics": true,
    "configuration_schema_registry": true,
    "configuration_schema_fingerprint": true,
    "configuration_type_validation": true,
    "configuration_constraint_validation": true,
    "configuration_dependency_rules": true,
    "configuration_conditional_rules": true,
    "configuration_cross_field_validation": true,
    "configuration_validation_reports": true,
    "configuration_invalid_candidate_rejection": true,
    "immutable_configuration_versions": true,
    "configuration_version_history": true,
    "configuration_version_identity": true,
    "configuration_parent_lineage": true,
    "configuration_change_sets": true,
    "semantic_configuration_diff": true,
    "configuration_actor_attribution": true,
    "configuration_change_reasons": true,
    "historical_configuration_reconstruction": true,
    "configuration_version_integrity_verification": true,
    "configuration_version_schema_fingerprint_association": true,
    "configuration_version_configuration_fingerprint_association": true,
    "configuration_version_persistence": true,
    "optimistic_configuration_version_concurrency": true,
    "configuration_current_version_pointer": true,
    "bounded_configuration_history_queries": true,
    "configuration_version_diagnostics": true,
    "historical_candidate_derivation_foundation": true,
    "backend_api": false,
    "frontend_control_center": false,
    "database_persistence": true,
    "event_bus": true,
    "durable_event_persistence": false,
    "distributed_event_broker": false,
    "comprehensive_configuration_schema_engine": true,
    "configuration_version_lifecycle": true,
    "feature_flags": true,
    "capability_management": true,
    "maker_checker_approval": true,
    "configuration_promotion": true,
    "configuration_rollback": true,
    "market_data_ingestion": true,
    "instrument_registry": true,
    "market_calendar": false,
    "market_sessions": false,
    "mose_surveillance": false,
    "market_intelligence": false,
    "regime_detection": false,
    "strategy_engine": false,
    "candidate_generation": false,
    "signal_scoring": false,
    "risk_engine": false,
    "portfolio_engine": false,
    "capital_protection_engine": false,
    "multi_account_management": false,
    "account_allocation": false,
    "execution_engine": false,
    "mt5_gateway": false,
    "connector_ea": false,
    "broker_order_submission": false,
    "reconciliation": false,
    "trade_management": false,
    "historical_data_lab": true,
    "data_quality_lab": true,
    "historical_replay_engine": true,
    "backtesting": false,
    "simulation": false,
    "paper_trading": false,
    "live_trading": false,
    "machine_learning": false,
    "third_party_integrations": false,
    "authentication_rbac": false,
    "production_deployment": false,
    "configuration_approval_policy": true,
    "change_sensitivity_classification": true,
    "separation_of_duties": true,
    "immutable_approval_requests": true,
    "immutable_approval_decisions": true,
    "approval_requirement_evaluation": true,
    "approval_eligibility_evaluation": true,
    "exact_version_approval_binding": true,